ontent	tags
Chiều 21-10, tại thành phố Hồ Chí Minh, Tạp chí Gia đình Việt Nam phối hợp với Công đoàn Cục Báo chí - Bộ Thông tin và Truyền thông, Hội Nhà báo Việt Nam tổ chức họp báo công bố Giải bóng đá các cơ quan báo chí toàn quốc - Press Cup 2024 khu vực phía Nam. Phát biểu tại họp báo, nhà báo Trần Trọng Dũng, Phó Chủ tịch Hội Nhà báo Việt Nam phụ trách khu vực phía Nam, Trưởng ban chỉ đạo Giải cho biết, Giải Bóng đá các Cơ quan Báo chí toàn quốc Press Cup lần thứ 8 năm 2024 khu vực phía Nam sẽ chính thức khai mạc lúc 7h30 ngày 23-10 tại Sân vận động Tao Đàn (Số 1 Huyền Trân Công Chúa, quận 1, thành phố Hồ Chí Minh). Theo Ban tổ chức, ngoài các đội bóng đến từ các cơ quan báo chí đóng trên địa bàn thành phố Hồ Chí Minh như: Báo Sài Gòn Giải Phóng, Người Lao Động, Đài tiếng nói Nhân dân thành phố Hồ Chí Minh VOH, Đài truyền hình thành phố, Trung tâm truyền hình Việt Nam tại thành phố Hồ Chí Minh (VTV9)…, năm nay có sự tham dự của đội bóng đến từ Đài Phát thanh và Truyền hình Tây Ninh. 12 đội bóng sẽ chia thành 3 bảng và thi đấu các lượt trận ở vòng bảng để tìm ra 2 đội mạnh nhất tham dự vòng chung kết toàn quốc sẽ diễn ra tại tỉnh Thái Nguyên vào tháng 11 tới. Theo Ban tổ chức, Giải đấu có ý nghĩa đẩy mạnh phong trào rèn luyện thể dục thể thao trong cán bộ, nhân viên, phóng viên, biên tập viên, nhà báo tại các cơ quan báo chí từ Trung ương đến địa phương. Qua đó, Giải tạo sân chơi, nâng cao thể chất, đời sống văn hóa tinh thần, tăng cường sự giao lưu, học hỏi giữa cán bộ, nhân viên, phóng viên, biên tập viên, các nhà báo trong mỗi cơ quan báo chí và giữa các cơ quan báo chí với nhau. Cơ cấu giải thưởng mùa giải Press Cup 2024: 1/ Giải Nhất: Cúp, huy chương vàng, cờ, 15 triệu đồng 2/ Giải Nhì: Huy chương bạc, cờ, 8 triệu đồng 3/ Giải Ba: Huy chương đồng, cờ và 5 triệu đồng 4/ Cầu thủ ghi nhiều bàn thắng nhất giải: Cờ, 2 triệu đồng 5/ Thủ môn xuất sắc nhất: Cờ, 2 triệu đồng 6/ Tổ trọng tài xuất sắc: Cờ, 2 triệu đồng 7/ Giải phong cách: Cờ, 2 triệu đồng 	Press Cup 2024,giải bóng đá,cơ quan báo chí,TP Hồ Chí Minh,Công đoàn Cục Báo chí,Trần Trọng Dũng,sân vận động Tao Đàn,Press Cup,khai mạc,vòng loại,toàn quốc,Hội Nhà báo Việt Nam,phía Nam,Huyền Trân,VTV9,bốc thăm chia bảng,giải đấu,nhà báo,biên tập viên,từ Trung ương đến địa phương
Giải vô địch Karate quốc gia lần thứ 33 năm 2024 diễn ra tại tỉnh Điện Biên từ ngày 18 - 22/10/2024. Tham dự giải có 38 đoàn với gần 400 VĐV, trong đó có nhiều VĐV nằm trong thành phần đội tuyển quốc gia. Các vận động viên tham gia tranh tài ở 2 nội dung là Kata và Kumite dành cho nam và nữ, tranh tài 30 bộ huy chương. Đoàn Hà Tĩnh có 8 VĐV tham gia và giành được 5 huy chương các loại (2 HCV, 1 HCB, 2 HCĐ). 2 HCV thuộc về VĐV Hoàng Thị Mỹ Tâm nội dung đối kháng hạng cân 62 kg; các VĐV Hoàng Thị Mỹ Tâm, Kiều Thị Quỳnh Như, Nguyễn Thị Bảo Ngọc nội dung đồng đội nữ. 1 HCB thuộc về VĐV Nguyễn Thị Bảo Ngọc nội dung đối kháng hạng cân 65 kg. 2 HCĐ thuộc về VĐV Hoàng Thị Mỹ Phương nội dung đối kháng hạng cân 56kg; VĐV Nguyễn Đình Việt nội dung đối kháng hạng cân 78kg. 	Nguyễn Thị Bảo Ngọc,Hoàng Thị Mỹ Tâm,huy chương,đội tuyển Karate Quốc gia,Huy chương Bạc,Hà Tĩnh,Kumite,Huy chương Đồng,Nguyễn Đình Việt,Huy chương Vàng,Kata,hạng cân,đối kháng,giành được,Karatedo,vận động viên,kế cận,trao đổi kinh nghiệm,tranh tài,Điện Biên
Các nội dung của quyền biểu diễn đã tranh tài đầu tiên trong ngày 21-10 tại nhà thi đấu tỉnh Gia Lai. Tại ngày thi đấu, nữ tuyển thủ có gương mặt khả ái Châu Tuyết Vân tiếp tục thể hiện phong độ cao, giành HCV cho taekwondo TPHCM. Ở nội dung quyền dành cho đôi nam-nữ, võ sỹ TPHCM đã chiếm trọn 2 HCV. Châu Tuyết Vân cùng Nguyễn Thiên Phụng phối hợp thực hiện bài trình diễn xuất sắc nhất thuyết phục các trọng tài và giành điểm tuyệt đối, nhận HCV nội dung quyền tiêu chuẩn đôi nam-nữ. Đây là HCV đầu tiên của Châu Tuyết Vân tại giải vô địch quốc gia năm nay. Trong khi đó, cặp võ sỹ Nguyễn Hải Trang, Tạ Bảo Quang thi đấu áp đảo trong nội dung quyền sáng tạo đôi nam-nữ, giành HCV. Ở nội dung quyền sáng tạo cá nhân nam, võ sỹ Hồ Thanh Ân của TPHCM được chấm điểm cao nhất và giành HCV. Trong nội dung này, võ sỹ Nguyễn Xuân Thành (Hà Nội) nỗ lực thể hiện nhưng không vượt qua được Thanh Ân nên xếp vị trí hạng nhì. Ngay sau đó tại nội dung quyền tiêu chuẩn đồng đội nam, đội TPHCM với Lê Thanh Trung, Nguyễn Văn Đáng, Nguyễn Quang Trí có bài biểu diễn tốt, giành HCV. Đáng tiếc, đội nữ TPHCM gồm Nguyễn Thị Hồng Trang, Nguyễn Thành Hiền Linh và Trần Cao Cẩm Tiên chỉ có được ngôi á quân do thua đội nữ Vĩnh Long trong chung kết. Tấm HCV thứ 5 của đội quyền taekwondo TPHCM thuộc về nhóm tuyển thủ Nguyễn Thanh Hiền Linh, Hồ Ngọc Anh Thư, Nông Thạch Khiêm, Trần Đăng Khoa, Nguyễn Ngọc Minh Hy tại nội dung quyền sáng tạo đồng đội. Tạm thời taekwondo TPHCM có 5 HCV, 3 HCB nên đứng vị trí số 1. Đơn vị Bình Thuận, An Giang, Hà Nội ở các vị trí tiếp theo. Giải taekwondo vô địch quốc gia 2024 còn tranh tài tới ngày 26-10. 	Châu Tuyết Vân,Huy chương Vàng,giải vô địch quốc gia,võ sĩ,Nguyễn Hải Trang,Nguyễn Thiên Phụng,Nguyễn Ngọc Minh Hy,Nguyễn Văn Đáng,đội TPHCM,Nguyễn Quang Trí,Nguyễn Thị Hồng Trang,Lê Thanh Trung,Nguyễn Xuân Thành,Trần Đăng Khoa,khả ái,được chấm,nhà thi đấu,giành điểm,tranh tài,giải vô địch
"Ngôi sao người Qatar nhận 18% số phiếu bầu, về đích ở vị trí thứ nhất. Xếp sau anh là Son Heung-min (16,8%) và Soufiane Rahimi (11,4%). Cristiano Ronaldo và Aleksandar Mitrovic, hai tay săn bàn hàng đầu ở giải Saudi Pro League, xếp thứ 4 và 5 trong cuộc bầu chọn. Giải thưởng này được trao bởi Titan Sports, khác với giải Cầu thủ hay nhất năm do Liên đoàn Bóng đá Châu Á (AFC) trao tặng, dành cho những cầu thủ thi đấu trong và ngoài châu Á. Akram Afif, 27 tuổi, là ngôi sao hàng đầu của bóng đá Qatar trong nhiều năm gần đây. Đỉnh cao của Afif là cú hat trick trong trận chung kết Asian Cup 2024 hồi tháng 2, giúp Qatar đánh bại Jordan với tỷ số 3-1. Anh cũng là vua phá lưới của giải với 8 bàn. Chiến thắng của Afif giúp kết thúc sự thống trị của ngôi sao Hàn Quốc Son Heung-min, người đã nhận giải này trong 7 năm liên tiếp trước đó. Akram Afif đang thi đấu tại Al Sadd. Mùa giải trước, anh ghi 26 bàn thắng, giành ngôi vua phá lưới tại giải Qatari Stars League, đồng thời giúp Al Sadd lên ngôi vô địch. Trước khi trở về Qatar, Akram Afif có thời gian thi đấu tại châu Âu cho Eupen (Bỉ) và Villarreal, Sporting Gijon (Tây Ban Nha) nhưng không thành công. Akram Afif cũng là cầu thủ đầu tiên giành giải thưởng này khi thi đấu cho một CLB thuộc AFC. Trước đó, Son Heung-min thắng giải vào năm 2014 khi còn chơi cho Bayer Leverkusen (Đức). Trong khoảng thời gian từ năm 2014 đến nay, chỉ có Keisuke Honda và Shinji Okazaki là đối thủ cạnh tranh danh hiệu với Son. Giải thưởng ""Cầu thủ hay nhất châu Á 2023"" được tổ chức bởi Titan Sports (Trung Quốc), lấy lá phiếu từ các chuyên gia, cựu cầu thủ, HLV và những nhà báo am hiểu bóng đá châu Á. Khác với mọi năm, khi giải thưởng được tính trong một năm dương lịch, giải Quả bóng vàng châu Á 2024 được tính từ ngày 1/1 đến 15/8. Titan Sports áp dụng cách tính thành tích tương tự những giải lớn trên thế giới. "	Akram Afif,Titan Sports,Afif,Son Heung-min,Soufiane Rahimi,Cristiano Ronaldo,Qatar,Al Sadd,Asian Cup 2024,tuyển Qatar,hat,Saudi Pro League,Aleksandar Mitrovic,trick,Liên đoàn Bóng đá châu Á,Shinji Okazaki,giành giải,Keisuke Honda,Sporting Gijon,giải lớn
Kết thúc các nội dung thi đấu, đoàn Hưng Yên giành được 6 huy chương (2 Huy chương Vàng, 3 Huy chương Bạc, 1 Huy chương Đồng), xếp thứ 3 toàn đoàn. Hai Huy chương Vàng thuộc về VĐV Nguyễn Thị Thảo ở nội dung đối kháng hạng 55kg và cặp VĐV Nguyễn Thị Mỹ Dung, Phạm Thị Thanh Dung ở nội dung biểu diễn quyền đôi nữ. Kết quả thi đấu của các VĐV tại giải là cơ sở để các nhà chuyên môn tuyển chọn những gương mặt tài năng, bổ sung cho đội tuyển quốc gia tham gia các giải Pencak Silat khu vực và quốc tế. 	Pencak Silat quốc gia,huy chương,Hưng Yên,vận động viên,Bà Rịa – Vũng Tàu,đối kháng,hạng cân,Nguyễn Thị Mỹ Dung,giải vô địch,Nguyễn Thị Thảo,quy tụ,đôi nữ,tranh tài,Pencak Silat,toàn đoàn,biểu diễn,nhà chuyên môn,đội tuyển,Huy chương Vàng,Huy chương Bạc